{
  "$schema": "../../templates/PROJECTION_TEMPLATE.schema.json",
  "template_type": "ontology_projection",
  "projection_version": "1.0.0",
  "projection": {
    "projection_id": "openclaw-skill-loading-domain-model-v1",
    "projection_type": "domain_model_projection",
    "target_name": "OpenClawSkillLoadingModel",
    "target_format": "csharp_domain_model",
    "target_runtime": "dotnet",
    "projection_goal": "Project the skill loading ontology slice into a domain model, validation rules, and prompt constraints for downstream codegen and orchestration.",
    "source_slice": {
      "path": "./sample.json",
      "slice_topic": "skill loading order, source precedence, and eligibility filtering",
      "schema_version": "1.0.0"
    },
    "intended_consumers": [
      "code_generator",
      "prompt_orchestrator"
    ]
  },
  "mapping_policy": {
    "preserve_source_trace": true,
    "preserve_constraints": true,
    "relation_flattening_policy": "disallow_by_default",
    "unresolved_item_policy": "block_or_escalate",
    "dropped_item_policy": "record_with_reason",
    "prompt_assumption_policy": "disallow_unmapped_terms"
  },
  "concept_mappings": [
    {
      "concept_id": "C1",
      "projection_action": "map",
      "target_kind": "domain_entity",
      "target_name": "SkillsConfigModel",
      "target_path": "Domain/SkillsConfigModel.cs",
      "source_ids": [
        "S2",
        "S3"
      ],
      "notes": "Keep the top-level skills configuration as the aggregate root carrying the system switch, allowBundled, and per-skill entries."
    },
    {
      "concept_id": "C3",
      "projection_action": "map",
      "target_kind": "domain_entity",
      "target_name": "SkillDefinitionModel",
      "target_path": "Domain/SkillDefinitionModel.cs",
      "source_ids": [
        "S2",
        "S3"
      ],
      "notes": "Model the skill definition as the core entity that ultimately enters the eligible skills set, preserving name, location, source, and metadata."
    },
    {
      "concept_id": "C4",
      "projection_action": "map",
      "target_kind": "enum",
      "target_name": "SkillSourceTier",
      "target_path": "Domain/SkillSourceTier.cs",
      "source_ids": [
        "S1",
        "S2",
        "S3",
        "S4"
      ],
      "notes": "Project source tiers as an enum so overwrite order and same-name precedence remain explicit."
    }
  ],
  "relation_mappings": [
    {
      "relation_id": "R3",
      "projection_action": "map",
      "target_kind": "association",
      "target_name": "SkillDefinitionOriginatesFromSource",
      "representation": "domain_association",
      "source_ids": [
        "S2",
        "S3"
      ],
      "notes": "Preserve the one-way association from SkillDefinition to SkillSource instead of flattening it into a plain string field."
    }
  ],
  "constraint_mappings": [
    {
      "constraint_id": "K1",
      "projection_action": "map",
      "target_kind": "runtime_guard",
      "target_name": "HigherPrioritySourceOverridesLowerPriority",
      "severity_mapping": "high -> blocking_validation",
      "source_ids": [
        "S1",
        "S2",
        "S4"
      ],
      "notes": "Project source precedence as a runtime guard so lower-priority sources cannot overwrite higher-priority ones."
    }
  ],
  "prompt_projection": {
    "allowed_terms": [
      "eligible skill",
      "skill source",
      "source precedence",
      "skill definition"
    ],
    "forbidden_assumptions": [
      "Do not assume managed or bundled skills automatically have the highest precedence.",
      "Do not collapse source tiers into plain labels that lose precedence semantics."
    ],
    "required_clarifications": [
      "If documentation and code disagree on the managed skills path, clarify whether code or docs are the source of truth before proceeding."
    ],
    "reasoning_paths": [
      "skills_config -> skill_load_config -> skill_source -> skill_definition",
      "skill_source -> precedence -> overwrite decision"
    ],
    "source_digest": [
      "Primary source: S2 src/OpenClaw.Core/Skills/SkillLoader.cs",
      "Primary source: S3 src/OpenClaw.Core/Skills/SkillModels.cs",
      "Conflict note: S1 and S2 differ on managed skill directory wording"
    ]
  },
  "delivery_artifacts": [
    {
      "artifact_name": "SkillsConfigModel.cs",
      "artifact_type": "code_file",
      "path": "src/OpenClaw.Core/Skills/Generated/SkillsConfigModel.cs",
      "status": "planned"
    },
    {
      "artifact_name": "SkillLoadingPromptPolicy.md",
      "artifact_type": "prompt_fragment",
      "path": "prompts/skill-loading/SkillLoadingPromptPolicy.md",
      "status": "planned"
    }
  ],
  "dropped_items": [
    {
      "item_type": "concept",
      "item_id": "C2",
      "reason": "This projection only keeps the top-level config, skill definition, and source tier; SkillLoadConfig is not emitted as a standalone artifact yet."
    }
  ],
  "open_questions": [],
  "meta": {
    "generated_at": "2026-04-21T00:00:00Z",
    "generated_by": "ontology_extraction",
    "workspace": "kingcrab",
    "notes": "This example is derived from examples/ready/sample.json and shows how a READY slice can be projected into combined domain-model and prompt-policy artifacts."
  }
}