{
  "$schema": "../../templates/PROJECTION_TEMPLATE.schema.json",
  "template_type": "ontology_projection",
  "projection_version": "1.0.0",
  "projection": {
    "projection_id": "openclaw-skill-source-minimal-projection-v1",
    "projection_type": "prompt_constraint_projection",
    "target_name": "SkillSourcePromptSeed",
    "target_format": "prompt_term_seed",
    "target_runtime": "llm_orchestrator",
    "projection_goal": "Provide the smallest valid projection that keeps one core concept and its source trace for downstream prompt orchestration.",
    "source_slice": {
      "path": "./sample.json",
      "slice_topic": "skill loading order, source precedence, and eligibility filtering",
      "schema_version": "1.0.0"
    },
    "intended_consumers": [
      "prompt_orchestrator"
    ]
  },
  "mapping_policy": {
    "preserve_source_trace": true,
    "preserve_constraints": true,
    "relation_flattening_policy": "disallow_by_default",
    "unresolved_item_policy": "block_or_escalate",
    "dropped_item_policy": "record_with_reason",
    "prompt_assumption_policy": "disallow_unmapped_terms"
  },
  "concept_mappings": [
    {
      "concept_id": "C4",
      "projection_action": "map",
      "target_kind": "prompt_term",
      "target_name": "skill_source",
      "target_path": "prompt.allowed_terms",
      "source_ids": [
        "S1",
        "S2",
        "S3"
      ],
      "notes": "Keep the source tier concept as a prompt term so downstream prompts can talk about precedence without flattening source semantics away."
    }
  ],
  "relation_mappings": [],
  "constraint_mappings": [],
  "prompt_projection": {
    "allowed_terms": [
      "skill source",
      "source precedence"
    ],
    "forbidden_assumptions": [
      "Do not assume all skill sources have the same overwrite priority."
    ],
    "required_clarifications": [
      "Clarify whether the downstream consumer needs full source precedence rules or only the source vocabulary."
    ],
    "reasoning_paths": [
      "skill_source -> source_precedence"
    ],
    "source_digest": [
      "Primary sources: S2 SkillLoader.cs and S3 SkillModels.cs"
    ]
  },
  "delivery_artifacts": [
    {
      "artifact_name": "SkillSourcePromptSeed.md",
      "artifact_type": "prompt_fragment",
      "path": "prompts/skill-loading/SkillSourcePromptSeed.md",
      "status": "planned"
    }
  ],
  "dropped_items": [
    {
      "item_type": "relation",
      "item_id": "R3",
      "reason": "This minimal example intentionally omits relation mappings so the file stays focused on the smallest valid prompt-facing projection."
    },
    {
      "item_type": "constraint",
      "item_id": "K1",
      "reason": "This minimal example omits constraint mappings to keep the projection as a smallest legal seed rather than a production-ready projection."
    }
  ],
  "open_questions": [],
  "meta": {
    "generated_at": "2026-04-21T00:00:00Z",
    "generated_by": "ontology_extraction",
    "workspace": "kingcrab",
    "notes": "Minimal valid projection example for teams that want the smallest machine-readable starting point before expanding into richer mappings."
  }
}